{
  "schemaVersion": 1,
  "proofKind": "trailmind_supabase_free_current_data_capacity_v1",
  "decision": "BOUNDED_TWO_REGION_PROFILE",
  "proofDate": "2026-08-28",
  "repository": {
    "branch": "codex/supabase-free-capacity-v1",
    "baselineCommit": "a36c646815f390b60df734147a78e82c8ef46dd1",
    "fetchedOriginMain": "a36c646815f390b60df734147a78e82c8ef46dd1",
    "isolatedWorktreeCleanBeforeMeasurement": true,
    "equivalentCurrentVolumeProofFound": false,
    "overlappingActiveTaskFound": false
  },
  "containment": {
    "remoteSupabaseContact": false,
    "remoteSupabaseMutation": false,
    "credentialAccess": false,
    "configurationLocalXcconfigAccess": false,
    "graphHopperCallCount": 0,
    "aiProviderCallCount": 0,
    "publicOverpassCallCount": 0,
    "competitorScrapeCount": 0,
    "loopbackOnlyPostgresql": true,
    "disposableClustersStopped": true,
    "disposableListenersRemaining": 0,
    "taskOwnedDownloadsDumpsLogsAndClustersRemoved": true,
    "initialFreeSpaceReadingsKiB": [15376156, 15373052],
    "initialFreeSpaceGateKiB": 12582912,
    "initialPostgresqlImportXcodeConflictFound": false,
    "ports": [55432, 55433]
  },
  "officialPolicy": {
    "checkedOn": "2026-08-28",
    "databaseSizeDocumentation": "https://supabase.com/docs/guides/platform/database-size",
    "databaseSizeDocumentationSnapshotSha256": "bee29c02ecd2233cfd403d4af0d24c981020e5633f750b08c10ab6a12e6cd984",
    "changelog": "https://supabase.com/changelog",
    "changelogSnapshotSha256": "49b064520ad70f592ea4ffc25f456fcc981404dc925f0c499e21438719a07163",
    "verifiedFacts": {
      "freeReadOnlyDatabaseSizeBytes": 500000000,
      "newProjectBaselineRangeBytes": [40000000, 60000000],
      "databaseSizeIsDistinctFromDiskAndWal": true,
      "extensionVersionPinningDeprecatedEffective": "2026-08-05",
      "postgresql17CurrentDefaultConfirmed": true
    },
    "capacityPolicy": {
      "hardPlanCeilingBytes": 500000000,
      "settledOperatingTargetBytes": 400000000,
      "requiredHardCeilingHeadroomBytes": 100000000,
      "conservativeManagedBaselineBytes": 60000000,
      "observedRemoteBaselineBytesUserSupplied": 11700000,
      "localEmptyBaselineBytes": 7804595,
      "managedEquivalentFormula": "local_pg_database_size - 7804595 + 60000000"
    }
  },
  "software": {
    "postgresql": "17.10",
    "postgis": "3.6.4",
    "postgisFullVersion": "POSTGIS=3.6.4 94d984b; PGSQL=170; GEOS=3.14.1-CAPI-1.20.5; PROJ=9.8.1; NETWORK_ENABLED=OFF; LIBXML=2.15.3; LIBJSON=0.19",
    "osm2pgsql": "2.3.1",
    "osmium": "1.19.1",
    "node": "22.22.3",
    "npm": "10.9.8",
    "supautils": {
      "version": "3.4.0",
      "commit": "7e8cfb7ec62a674a7bb28cbbf78b9612838b8468",
      "dylibSha256": "9c84350571d6893b8ed439603004fef371b1224c862b89d025c195e09464014d"
    }
  },
  "sources": [
    {
      "id": "niedersachsen",
      "publisher": "Geofabrik",
      "url": "https://download.geofabrik.de/europe/germany/niedersachsen-latest.osm.pbf",
      "sourceDataTimestamp": "2026-08-26T20:22:15Z",
      "replicationSequence": 4883,
      "bytes": 503254893,
      "publishedMd5": "9ea0580046ace0ad27104a3b7fdac871",
      "publishedMd5Verified": true,
      "sha256": "6029c847b32e6402195c9acf51791a32da763cf4daed50fe128a9ce830c42654"
    },
    {
      "id": "sachsen-anhalt",
      "publisher": "Geofabrik",
      "url": "https://download.geofabrik.de/europe/germany/sachsen-anhalt-latest.osm.pbf",
      "sourceDataTimestamp": "2026-08-26T20:22:15Z",
      "replicationSequence": 4884,
      "bytes": 173790914,
      "publishedMd5": "d997d174c51b07744cb5326378923be2",
      "publishedMd5Verified": true,
      "sha256": "45abfb5fa16892c91e79f137b084e7ea21b5eef60ea8efba7eca29c2bdd2d381"
    },
    {
      "id": "thueringen",
      "publisher": "Geofabrik",
      "url": "https://download.geofabrik.de/europe/germany/thueringen-latest.osm.pbf",
      "sourceDataTimestamp": "2026-08-26T20:22:15Z",
      "replicationSequence": 4885,
      "bytes": 159236450,
      "publishedMd5": "389fc279ac94e3a3e62a6d01ff6a9f19",
      "publishedMd5Verified": true,
      "sha256": "a5b0e226d4f3c698879cce214840648ce1d98c1f083155dfb16ae0ae46ea0ac5"
    },
    {
      "id": "austria",
      "publisher": "Geofabrik",
      "url": "https://download.geofabrik.de/europe/austria-latest.osm.pbf",
      "sourceDataTimestamp": "2026-08-26T20:22:15Z",
      "replicationSequence": 4891,
      "bytes": 808333364,
      "publishedMd5": "3893c70121a683be3aaea68cac673b0c",
      "publishedMd5Verified": true,
      "sha256": "91ef35acbdb50e0c02ce0a3ac2e755145144f806d397480157767b53b1525cf8"
    }
  ],
  "migrationPolicy": {
    "id": "supabase-postgis-isolation-v2",
    "historical008Applied": false,
    "exactBytesApplied": true,
    "firstRunAppliedCount": 9,
    "secondRunAppliedCount": 0,
    "secondRunStdoutBytes": 0,
    "secondRunStderrBytes": 0,
    "files": [
      { "name": "001_app_attest.sql", "sha256": "f25c5c712563d53abc926c34196e603b54d6ce7d414b5f22fdf95ec49ae95c16" },
      { "name": "002_outdoor_evidence.sql", "sha256": "750d715dc4662ca725a3c04de91c559e6dfc9455332be23eb95fa509dceafd7d" },
      { "name": "003_outdoor_research_graph.sql", "sha256": "79eaf76eea21c6a3476fb801cfae432bccdbc3260421dcfb9e123513b6bb3928" },
      { "name": "004_osm_outdoor_research_projection.sql", "sha256": "7a876c955740021ca173300409c97a869e1c6aebbdb8dffdf773295d39d7bbb3" },
      { "name": "005_outdoor_research_projection_geometry.sql", "sha256": "945688fdff722cfdab62f72fc7b9bd5c27335e10161054f3909e774094ae6bc8" },
      { "name": "006_outdoor_route_membership_point_index.sql", "sha256": "13ad98c4fc0fa19b27ad7a398bbaca8a6dfdfb1a29616e2de25c4a877843e8c4" },
      { "name": "007_routable_highlight_access_geography_index.sql", "sha256": "d3eb65d307f28e65bdaa234be7a6fc1cd7ceec47499ebd40e05b61fdb40657f7" },
      { "name": "009_supabase_postgis_isolated_runtime_read_contract.sql", "sha256": "92f51e93280027b77081b2cc96beaf10c2c25ba225ebbf527e78239a50040294" },
      { "name": "010_bounded_outdoor_import_schema_provisioning.sql", "sha256": "62f23c605654fc3e58661646d376bf68cca8e95c0e9354dc9da6d77c765ef467" }
    ],
    "excludedHistorical008Sha256": "e568e6ea65bd0d6f96fd20f636efcbb42700c55856ea3f19d1955b6a9e415b32"
  },
  "measurements": {
    "databaseStages": [
      {
        "stage": "empty_supabase_equivalent_system_and_postgis_baseline",
        "localBytes": 7804595,
        "managedEquivalentBytes": 60000000
      },
      {
        "stage": "migrations_and_postgis_before_outdoor_data",
        "localBytes": 18699955,
        "incrementOverLocalEmptyBytes": 10895360,
        "managedEquivalentBytes": 70895360
      },
      {
        "stage": "full_harz_active_projection_settled_after_vacuum_analyze",
        "localBytes": 1055987379,
        "managedEquivalentBytes": 1108182784,
        "importPeakBytes": 462722739,
        "dryProjectionPeakBytes": 1030829747,
        "activeProjectionPeakBytes": 1959409331,
        "deadTuplesAfter": 0,
        "fitsHardCeiling": false
      },
      {
        "stage": "full_innsbruck_active_projection_settled_after_vacuum_analyze",
        "localBytes": 576345779,
        "managedEquivalentBytes": 628541184,
        "importPeakBytes": 293090995,
        "dryProjectionPeakBytes": 582129331,
        "activeProjectionPeakBytes": 1073338035,
        "deadTuplesAfter": 0,
        "fitsHardCeiling": false
      },
      {
        "stage": "full_harz_plus_full_innsbruck_settled_after_vacuum_analyze",
        "localBytes": 1615787699,
        "managedEquivalentBytes": 1667983104,
        "activeProjectionPeakBytes": 2112452275,
        "deadTuplesAfter": 0,
        "fitsHardCeiling": false
      },
      {
        "stage": "bounded_two_core_initial_generation_import_settled",
        "localBytes": 34543283,
        "managedEquivalentBytes": 86738688,
        "transientPeakBytes": 62953139
      },
      {
        "stage": "bounded_two_core_initial_generation_active_projection_settled",
        "localBytes": 172078771,
        "managedEquivalentBytes": 224274176,
        "dryProjectionPeakBytes": 129382067
      },
      {
        "stage": "bounded_two_core_retained_refresh_imports_settled",
        "localBytes": 187152051,
        "managedEquivalentBytes": 239347456,
        "transientPeakBytes": 215873203
      },
      {
        "stage": "bounded_two_core_retained_refresh_projection_peak",
        "localBytes": 400864947,
        "managedEquivalentBytes": 453060352,
        "hardCeilingHeadroomBytes": 46939648
      },
      {
        "stage": "bounded_two_core_retained_refresh_settled_before_maintenance",
        "localBytes": 303167155,
        "managedEquivalentBytes": 355362560,
        "deadTuples": 28
      },
      {
        "stage": "bounded_two_core_retained_refresh_settled_after_vacuum_analyze",
        "localBytes": 303462067,
        "managedEquivalentBytes": 355657472,
        "observedRemoteBaselineEquivalentBytes": 307357472,
        "settledOperatingTargetHeadroomBytes": 44342528,
        "hardCeilingHeadroomBytes": 144342528,
        "deadTuples": 0
      }
    ],
    "rejectedProfiles": [
      {
        "profile": "full-harz-only",
        "reason": "Harz alone exceeds the hard ceiling before another region is added",
        "localSettledBytes": 1055987379
      },
      {
        "profile": "full-innsbruck-only",
        "reason": "Innsbruck alone exceeds the hard ceiling",
        "localSettledBytes": 576345779
      },
      {
        "profile": "full-harz-plus-bounded-innsbruck",
        "reason": "Rejected by monotonic lower bound because full Harz alone exceeds the hard ceiling"
      },
      {
        "profile": "broad-bounded-harz-plus-broad-bounded-innsbruck",
        "reason": "Settled managed-equivalent size exceeds the 400 MB operating target and transient projection exceeds the 500 MB hard ceiling",
        "localSettledBytes": 436360883,
        "managedEquivalentSettledBytes": 488556288,